{
  "$schema": "./registry.schema.json",
  "version": "2.5.0",
  "source": "lucide-and-plantim-custom",
  "icons": {
    "Activity": {
      "id": "utility.activity",
      "lucide": "Activity",
      "viewBox": "0 0 24 24",
      "nodes": [
        {
          "type": "rect",
          "attrs": {
            "width": "18",
            "height": "18",
            "x": "3",
            "y": "3",
            "rx": "2",
            "key": "afitv7"
          }
        },
        {
          "type": "path",
          "attrs": {
            "d": "M17 12h-2l-2 5-2-10-2 5H7",
            "key": "15hlnc"
          }
        }
      ],
      "accessibility": "decorative",
      "aliases": [
        "lucide.activity"
      ],
      "category": "utility"
    },
    "AlertCircle": {
      "id": "status.error",
      "lucide": "AlertCircle",
      "viewBox": "0 0 24 24",
      "nodes": [
        {
          "type": "circle",
          "attrs": {
            "cx": "12",
            "cy": "12",
            "r": "10",
            "key": "1mglay"
          }
        },
        {
          "type": "line",
          "attrs": {
            "x1": "12",
            "x2": "12",
            "y1": "8",
            "y2": "12",
            "key": "1pkeuh"
          }
        },
        {
          "type": "line",
          "attrs": {
            "x1": "12",
            "x2": "12.01",
            "y1": "16",
            "y2": "16",
            "key": "4dfq90"
          }
        }
      ],
      "accessibility": "status",
      "category": "status",
      "accessibilityLabelKey": "a11y.icons.status.error"
    },
    "AlertTriangle": {
      "id": "status.warning",
      "lucide": "AlertTriangle",
      "viewBox": "0 0 24 24",
      "nodes": [
        {
          "type": "path",
          "attrs": {
            "d": "m21.73 18-8-14a2 2 0 0 0-3.48 0l-8 14A2 2 0 0 0 4 21h16a2 2 0 0 0 1.73-3",
            "key": "wmoenq"
          }
        },
        {
          "type": "path",
          "attrs": {
            "d": "M12 9v4",
            "key": "juzpu7"
          }
        },
        {
          "type": "path",
          "attrs": {
            "d": "M12 17h.01",
            "key": "p32p05"
          }
        }
      ],
      "accessibility": "status",
      "category": "status",
      "accessibilityLabelKey": "a11y.icons.status.warning"
    },
    "AlignJustify": {
      "id": "utility.align.justify",
      "lucide": "AlignJustify",
      "viewBox": "0 0 24 24",
      "nodes": [
        {
          "type": "path",
          "attrs": {
            "d": "M3 5h18",
            "key": "1u36vt"
          }
        },
        {
          "type": "path",
          "attrs": {
            "d": "M3 12h18",
            "key": "1i2n21"
          }
        },
        {
          "type": "path",
          "attrs": {
            "d": "M3 19h18",
            "key": "awlh7x"
          }
        }
      ],
      "accessibility": "decorative",
      "aliases": [
        "lucide.align.justify"
      ],
      "category": "utility"
    },
    "ArrowDown": {
      "id": "utility.arrow.down",
      "lucide": "ArrowDown",
      "viewBox": "0 0 24 24",
      "nodes": [
        {
          "type": "path",
          "attrs": {
            "d": "m3 16 4 4 4-4",
            "key": "1co6wj"
          }
        },
        {
          "type": "path",
          "attrs": {
            "d": "M7 20V4",
            "key": "1yoxec"
          }
        },
        {
          "type": "path",
          "attrs": {
            "d": "M20 8h-5",
            "key": "1vsyxs"
          }
        },
        {
          "type": "path",
          "attrs": {
            "d": "M15 10V6.5a2.5 2.5 0 0 1 5 0V10",
            "key": "ag13bf"
          }
        },
        {
          "type": "path",
          "attrs": {
            "d": "M15 14h5l-5 6h5",
            "key": "ur5jdg"
          }
        }
      ],
      "accessibility": "decorative",
      "aliases": [
        "lucide.arrow.down"
      ],
      "category": "utility"
    },
    "ArrowDownToDot": {
      "id": "utility.arrow.down.to.dot",
      "lucide": "ArrowDownToDot",
      "viewBox": "0 0 24 24",
      "nodes": [
        {
          "type": "path",
          "attrs": {
            "d": "M12 2v14",
            "key": "jyx4ut"
          }
        },
        {
          "type": "path",
          "attrs": {
            "d": "m19 9-7 7-7-7",
            "key": "1oe3oy"
          }
        },
        {
          "type": "circle",
          "attrs": {
            "cx": "12",
            "cy": "21",
            "r": "1",
            "key": "o0uj5v"
          }
        }
      ],
      "accessibility": "decorative",
      "aliases": [
        "lucide.arrow.down.to.dot"
      ],
      "category": "utility"
    },
    "ArrowLeft": {
      "id": "navigation.back",
      "lucide": "ArrowLeft",
      "viewBox": "0 0 24 24",
      "nodes": [
        {
          "type": "circle",
          "attrs": {
            "cx": "12",
            "cy": "12",
            "r": "10",
            "key": "1mglay"
          }
        },
        {
          "type": "path",
          "attrs": {
            "d": "m12 8-4 4 4 4",
            "key": "15vm53"
          }
        },
        {
          "type": "path",
          "attrs": {
            "d": "M16 12H8",
            "key": "1fr5h0"
          }
        }
      ],
      "accessibility": "decorative",
      "category": "navigation"
    },
    "ArrowRight": {
      "id": "navigation.forward",
      "lucide": "ArrowRight",
      "viewBox": "0 0 24 24",
      "nodes": [
        {
          "type": "circle",
          "attrs": {
            "cx": "12",
            "cy": "12",
            "r": "10",
            "key": "1mglay"
          }
        },
        {
          "type": "path",
          "attrs": {
            "d": "m12 16 4-4-4-4",
            "key": "1i9zcv"
          }
        },
        {
          "type": "path",
          "attrs": {
            "d": "M8 12h8",
            "key": "1wcyev"
          }
        }
      ],
      "accessibility": "decorative",
      "category": "navigation"
    },
    "ArrowUp": {
      "id": "utility.arrow.up",
      "lucide": "ArrowUp",
      "viewBox": "0 0 24 24",
      "nodes": [
        {
          "type": "path",
          "attrs": {
            "d": "m3 8 4-4 4 4",
            "key": "11wl7u"
          }
        },
        {
          "type": "path",
          "attrs": {
            "d": "M7 4v16",
            "key": "1glfcx"
          }
        },
        {
          "type": "path",
          "attrs": {
            "d": "M20 8h-5",
            "key": "1vsyxs"
          }
        },
        {
          "type": "path",
          "attrs": {
            "d": "M15 10V6.5a2.5 2.5 0 0 1 5 0V10",
            "key": "ag13bf"
          }
        },
        {
          "type": "path",
          "attrs": {
            "d": "M15 14h5l-5 6h5",
            "key": "ur5jdg"
          }
        }
      ],
      "accessibility": "decorative",
      "aliases": [
        "lucide.arrow.up"
      ],
      "category": "utility"
    },
    "ArrowUpFromDot": {
      "id": "utility.arrow.up.from.dot",
      "lucide": "ArrowUpFromDot",
      "viewBox": "0 0 24 24",
      "nodes": [
        {
          "type": "path",
          "attrs": {
            "d": "m5 9 7-7 7 7",
            "key": "1hw5ic"
          }
        },
        {
          "type": "path",
          "attrs": {
            "d": "M12 16V2",
            "key": "ywoabb"
          }
        },
        {
          "type": "circle",
          "attrs": {
            "cx": "12",
            "cy": "21",
            "r": "1",
            "key": "o0uj5v"
          }
        }
      ],
      "accessibility": "decorative",
      "aliases": [
        "lucide.arrow.up.from.dot"
      ],
      "category": "utility"
    },
    "Award": {
      "id": "utility.award",
      "lucide": "Award",
      "viewBox": "0 0 24 24",
      "nodes": [
        {
          "type": "path",
          "attrs": {
            "d": "m15.477 12.89 1.515 8.526a.5.5 0 0 1-.81.47l-3.58-2.687a1 1 0 0 0-1.197 0l-3.586 2.686a.5.5 0 0 1-.81-.469l1.514-8.526",
            "key": "1yiouv"
          }
        },
        {
          "type": "circle",
          "attrs": {
            "cx": "12",
            "cy": "8",
            "r": "6",
            "key": "1vp47v"
          }
        }
      ],
      "accessibility": "decorative",
      "aliases": [
        "lucide.award"
      ],
      "category": "utility"
    },
    "Baby": {
      "id": "utility.baby",
      "lucide": "Baby",
      "viewBox": "0 0 24 24",
      "nodes": [
        {
          "type": "path",
          "attrs": {
            "d": "M10 16c.5.3 1.2.5 2 .5s1.5-.2 2-.5",
            "key": "1u7htd"
          }
        },
        {
          "type": "path",
          "attrs": {
            "d": "M15 12h.01",
            "key": "1k8ypt"
          }
        },
        {
          "type": "path",
          "attrs": {
            "d": "M19.38 6.813A9 9 0 0 1 20.8 10.2a2 2 0 0 1 0 3.6 9 9 0 0 1-17.6 0 2 2 0 0 1 0-3.6A9 9 0 0 1 12 3c2 0 3.5 1.1 3.5 2.5s-.9 2.5-2 2.5c-.8 0-1.5-.4-1.5-1",
            "key": "11xh7x"
          }
        },
        {
          "type": "path",
          "attrs": {
            "d": "M9 12h.01",
            "key": "157uk2"
          }
        }
      ],
      "accessibility": "decorative",
      "aliases": [
        "lucide.baby"
      ],
      "category": "utility"
    },
    "BadgeCheck": {
      "id": "utility.badge.check",
      "lucide": "BadgeCheck",
      "viewBox": "0 0 24 24",
      "nodes": [
        {
          "type": "path",
          "attrs": {
            "d": "M3.85 8.62a4 4 0 0 1 4.78-4.77 4 4 0 0 1 6.74 0 4 4 0 0 1 4.78 4.78 4 4 0 0 1 0 6.74 4 4 0 0 1-4.77 4.78 4 4 0 0 1-6.75 0 4 4 0 0 1-4.78-4.77 4 4 0 0 1 0-6.76Z",
            "key": "3c2336"
          }
        },
        {
          "type": "path",
          "attrs": {
            "d": "m9 12 2 2 4-4",